{
  "schemaVersion": 1,
  "releaseVersion": "0.1.0-rc.1",
  "sourceCommit": "abc1234",
  "lockDigests": {
    "adapters/windows/uv.lock": "c59bfd458b0c4d3793c2d7d832598e5098bb925f94618a96f1cd82afbb12ab39",
    "grounding/uv.lock": "2a2793b5a38132be234c63967d89d59baed58a15d55e3c8fb75ac9228feff841"
  },
  "contractArchive": {
    "version": "v1",
    "sha256": "133239bd3f0ae2fb8979669e1f886f82dc4570bbd052b5b83252e395fd5aba11"
  },
  "requiredEvidence": [
    "parity",
    "windows-native",
    "mac-native"
  ],
  "artifacts": [
    {
      "role": "contracts",
      "location": "contracts.zip",
      "bytes": 30,
      "sha256": "133239bd3f0ae2fb8979669e1f886f82dc4570bbd052b5b83252e395fd5aba11",
      "compatibleWith": {
        "hostAppRange": ">=0.1.0"
      }
    },
    {
      "role": "plugin",
      "location": "contracts.zip",
      "bytes": 30,
      "sha256": "133239bd3f0ae2fb8979669e1f886f82dc4570bbd052b5b83252e395fd5aba11",
      "compatibleWith": {
        "hostAppRange": ">=0.1.0"
      },
      "noticesPath": "THIRD_PARTY_NOTICES"
    },
    {
      "role": "windows-env",
      "location": "windows-env.json",
      "bytes": 29,
      "sha256": "7495382d2927bee37553c1604898509b1fd2c7bd55837f6fccfa97e7cbf791b1",
      "platform": "win32-x64",
      "launchProfile": "launch-profile.json",
      "noticesPath": "THIRD_PARTY_NOTICES",
      "compatibleWith": {
        "hostAppRange": ">=0.1.0"
      },
      "evidenceRequired": true
    },
    {
      "role": "mac-native",
      "location": "helper-darwin",
      "bytes": 39,
      "sha256": "e09f4a72788edf6490f838c5c698fa1085e851725239f0d544e6cd5eb60f966c",
      "platform": "darwin-arm64",
      "signingIdentity": "Developer ID Application: AiFetchly (SPIKEPENDING)",
      "compatibleWith": {
        "hostAppRange": ">=0.1.0"
      }
    },
    {
      "role": "model",
      "location": "model-manifest.json",
      "bytes": 2321,
      "sha256": "9021dcfbe11e427608fd7239e219742244d4d4f9b4fa6d4bc2d9cbed9038bef2",
      "modelManifestPath": "model-manifest.json",
      "compatibleWith": {
        "runtimeId": "grounding-model-gui-actor-2b-fp16"
      },
      "evidenceRequired": true
    },
    {
      "role": "evidence",
      "location": "report-parity.json",
      "bytes": 1224,
      "sha256": "dcca73ee5fc191dbee48c0efb7ea62a1b17f2291fbc49f64ba72c4d6ec8f5059",
      "suite": "parity",
      "reportPath": "report-parity.json"
    },
    {
      "role": "evidence",
      "location": "report-windows-native.json",
      "bytes": 1195,
      "sha256": "859829cb3535e0fbc6985cba7e47b3bf7279b8489523273d0e46358fb13933bd",
      "suite": "windows-native",
      "reportPath": "report-windows-native.json"
    },
    {
      "role": "evidence",
      "location": "report-mac-native.json",
      "bytes": 1198,
      "sha256": "19888fdbd19f818422daa0c5f92e8d708708ace39f745ef72a6312ee022b2f2f",
      "suite": "mac-native",
      "reportPath": "report-mac-native.json"
    }
  ]
}
