{
  "schemaVersion": 1,
  "releaseVersion": "0.1.0-rc.1",
  "sourceCommit": "abc1234",
  "lockDigests": {
    "adapters/windows/uv.lock": "1111111111111111111111111111111111111111111111111111111111111111",
    "grounding/uv.lock": "2222222222222222222222222222222222222222222222222222222222222222"
  },
  "contractArchive": {
    "version": "v1",
    "sha256": "133239bd3f0ae2fb8979669e1f886f82dc4570bbd052b5b83252e395fd5aba11"
  },
  "requiredEvidence": [
    "parity"
  ],
  "artifacts": [
    {
      "role": "contracts",
      "location": "contracts.zip",
      "bytes": 30,
      "sha256": "133239bd3f0ae2fb8979669e1f886f82dc4570bbd052b5b83252e395fd5aba11"
    },
    {
      "role": "plugin",
      "location": "contracts.zip",
      "bytes": 30,
      "sha256": "133239bd3f0ae2fb8979669e1f886f82dc4570bbd052b5b83252e395fd5aba11"
    },
    {
      "role": "windows-env",
      "location": "windows-env.json",
      "bytes": 29,
      "sha256": "7495382d2927bee37553c1604898509b1fd2c7bd55837f6fccfa97e7cbf791b1",
      "platform": "win32-x64",
      "launchProfile": "../../adapters/windows/launch-profile.json",
      "noticesPath": "../../THIRD_PARTY_NOTICES",
      "evidenceRequired": true
    },
    {
      "role": "mac-native",
      "location": "helper-darwin",
      "bytes": 39,
      "sha256": "e09f4a72788edf6490f838c5c698fa1085e851725239f0d544e6cd5eb60f966c",
      "platform": "darwin-arm64",
      "signingIdentity": "Developer ID Application: AiFetchly (SPIKEPENDING)"
    },
    {
      "role": "model",
      "location": "model-manifest.json",
      "bytes": 1913,
      "sha256": "d1e93ee35b0d872f290cc468f5b94a063a0a06635bb0d005f99eded0a690338a",
      "modelManifestPath": "model-manifest.json",
      "evidenceRequired": true
    },
    {
      "role": "evidence",
      "location": "report-parity.json",
      "bytes": 1224,
      "sha256": "dcca73ee5fc191dbee48c0efb7ea62a1b17f2291fbc49f64ba72c4d6ec8f5059",
      "suite": "parity",
      "reportPath": "report-parity.json"
    }
  ]
}