{
  "schemaVersion": 1,
  "releaseVersion": "0.1.0-rc.esc",
  "sourceCommit": "abc1234",
  "contractArchive": {
    "version": "v1",
    "sha256": "9c5729595fb287cc2a2256280448bbe706c0a866f0372515c7483de2af4e6532"
  },
  "requiredEvidence": [],
  "artifacts": [
    {
      "role": "contracts",
      "location": "../release-evil/evil.bin",
      "bytes": 16,
      "sha256": "9c5729595fb287cc2a2256280448bbe706c0a866f0372515c7483de2af4e6532",
      "compatibleWith": {
        "hostAppRange": ">=0.1.0"
      }
    }
  ]
}